Em Prospecção,,,,Análise de Proposta de Fornecedores,Efetuar análise de proposta de fornecedores com base em solicitação de demandas (SD) e documento de arquitetura,,3.0,Montamos um ambiente para os primeiros testes antes de dar forma ao experimento,TI,Gustavo Leite / Vini,Beon Labs,,,,,,,,2025-06-17,9.0,
Em Prospecção,,,,Eficiência Dir. Plan FIN,,,,,,,,,,,,,,,2025-07-07,,
Em Prospecção,,,,Validação de OS´s elegíveis,Validar a integridade da base de ordens de serviços executados pelas empreiteiras.,,,,HITSS,Benigno Delgado / Luci Moreira,Beon Labs,,,,,,,,,,
Em Prospecção,,,,Ambiente Estratégico,Análise exaustiva de base processual disponível publicamente.,,,,HITSS,Isabela Cahú / Wilso Bocchi e João Deiro,Beon Labs,,,,,,,,,,
Concluído,Em andamento,,,Leitura Automática de Doc. Pessoal​ (Smart Validation),"No processo de vendas de e-commerce, há situações em que é necessário solicitar ao cliente o envio de cópias de documentos pessoais e cadastrais para confirmar ou corrigir informações antes de prosseguir com o pedido. Atualmente, esse procedimento é realizado manualmente pela equipe de backoffice, o que torna o processo mais demorado, podendo resultar em perda de vendas e gerar um custo mensal significativo.",,3.0,Em andamento,Digital,Rodrigo Duclos / Marcos Zumba,Digital,,2025-08-06 00:00:00,,,,,,2025-07-18,,
Concluído,Em backlog,,,Explicação de Fatura​,"O maior ofensor na quantidade de ligações na central de atendimento está relacionado a assuntos financeiros, inclusive dúvidas sobre a fatura, discordância sobre valores, dúvidas sobre planos etc. Logo existe uma oportunidade de ""digitalizar"" parte dessas questões financeiras visando melhorar a experiencia do cliente e também reduzir custos.",,,,Digital,Albervan Luz (???),Digital,,,,,,,,2025-07-18,,
Concluído,Em andamento,,,Recomendador de Produtos (Smart Sales)​,"A proposta é criar um módulo que identifique as necessidades dos clientes durante a jornada de vendas no e-commerce da Claro e disponibilize os produtos que atendam essas necessidades. Essas necessidades podem ser extraídas através da análise de faturas de concorrentes fornecidas pelos clientes, por meio de uma interface de perguntas e respostas ou pela captura de necessidades em campos de texto livre.",,3.0,Em andamento,Digital,Rodrigo Duclos / Marcos Zumba,Digital,,2025-08-15 00:00:00,,,,,,2025-07-18,,
Concluído,Em andamento,,,Validação Inteligente de Endereços​ (Match HP),"Desenvolver um componente que faça a correlação automática do endereço informado pelo cliente durante a jornada de venda com os dados existentes na base cabeada. Esse componente deve ser integrado à jornada de venda do e-commerce, seja pelo site, WhatsApp ou qualquer outro canal.",,3.0,Em andamento,Digital,Rodrigo Duclos / Marcos Zumba,Digital,,2025-08-12 00:00:00,,,,,,2025-07-18,,
Concluído,Arquivado,,,Leitura Automática de Comprovantes de Pagamento​,"Automatizar o envio de documentos para reavaliação de crédito de prospects, eliminando a intervenção humana. O mecanismo analisará automaticamente os comprovantes de pagamento enviados pelos clientes, gerando um status da análise que ficará disponível para outras ferramentas, eliminando a necessidade de backoffice.",,3.0,cancelada por reorganização do processo ,Digital,Rodrigo Duclos / Marcos Zumba,Digital,,,,,,,,2025-07-18,,
Concluído,Em backlog,,,Assistente para cadastro de credencial digital,"Desenvolver um assistente capaz de guiar o cliente na criação de sua credencial digital, e que seja flexivel suficiente para ser conectado em qualquer ponto da jornada do cliente, sendo ele um cliente novo ou cliente da base.",,,,Digital,Rodrigo Duclos / Rafael Boscolo,Digital,,,,,,,,2025-07-18,,
Concluído,Concluido - Aguardando Go/No para Piloto,,,M365 ( CoPilot),"Entender possíveis ganhos de produtividade no uso da
ferramenta, analisando riscos, benefícios, custos, perfis mais
aderentes, adoção, abandono e influencia da capacitação._x000D_",,3.0,Agenda para apresentação para Rodrigo Marques,Digital,Rodrigo Duclos / Ricardo Ferro,Digital,,,,,,,,2025-07-18,,
Backlog,,,,Converter SD em Desenho de Arquitetura,,,3.0,"Possivelmenter DevEx, verificar com Rosa.",,,,,,,,,,,,,
Concluído,Em refinamento,,,JIRA ROVO,,,,,,,,,,,,,,,,,
Em Prospecção,,,,LT IA,Experimento com plataforma da IBM para solução de RAG que visa criar um assistente para respoinder dúvidas para desenvolvedores (cerca de 100). A ideia é desafogar o LT (4) e aumentar a produtividade.,,3.0,"Reunião para entendimento e esclarecimento do processo de experimetação e aguadando o OK do Sponsor para avaliar se vão seguir em frente. Há oportunidade de ser uma feaature do DevEX, Rosa.",TI,Gaiotto / Melkih,Beon Labs,,,,,,,,2025-08-28,,
Backlog,,,,Contestação de Fatura ,Diminuir quantidade de backoffice que é atualmente 2¨6% da base. Atualmente 60% do que tratam são contestações improcedentes. ,,3.0,,Digital,Rodrigo Duclos / Gabriel Dias,Digital,,2025-09-26 00:00:00,,,,,,,,
